/player/kevin-curtis?position=DB, Kevin Curtis, S, Texas Tech,2002
/player/kevin-garrett?position=DB, Kevin Garrett, CB, SMU,2003
/player/kevin-johnson-2015?position=DB, Kevin Johnson, CB, Wake Forest,2015
/player/kevin-king?position=DB, Kevin King, CB, Washington,2017
/player/kevin-payne?position=DB, Kevin Payne, S, Louisiana-Monroe,2007
/player/kevin-peterson?position=DB, Kevin Peterson, CB, Oklahoma State,2016
/player/kevin-rutland?position=DB, Kevin Rutland, CB, Missouri,2011
/player/kevin-thomas-2010?position=DB, Kevin Thomas, CB, USC,2010
/player/kevin-thomas?position=DB, Kevin Thomas, CB, UNLV,2002
/player/kevin-white-2015?position=DB, Kevin White, CB, TCU,2015
/player/kevon-seymour?position=DB, Kevon Seymour, CB, USC,2016
/player/keyuo-craver?position=DB, Keyuo Craver, CB, Nebraska,2002
/player/khalid-naziruddin?position=DB, Khalid Naziruddin, CB, Texas Tech,2006
/player/khalid-wooten?position=DB, Khalid Wooten, CB, Nevada,2013
/player/ko-simpson?position=DB, Ko Simpson, S, South Carolina,2006
/player/korey-banks?position=DB, Korey Banks, CB, Mississippi State,2003
/player/kris-richard?position=DB, Kris Richard, CB, USC,2002
/player/kurt-coleman?position=DB, Kurt Coleman, S, Ohio State,2010
/player/malcolm-jenkins?position=DB, Malcolm Jenkins, S, Ohio State,2009
/player/malik-hooker?position=DB, Malik Hooker, S, Ohio State,2017
/player/marc-anthony?position=DB, Marc Anthony, CB, California,2013
/player/marcell-allmond?position=DB, Marcell Allmond, CB, USC,2004
/player/marcus-demps?position=DB, Marcus Demps, S, San Diego State,2006
/player/marcus-gilchrist?position=DB, Marcus Gilchrist, CB, Clemson,2011
/player/marcus-griffin?position=DB, Marcus Griffin, S, Texas,2008
/player/marcus-maxey?position=DB, Marcus Maxey, CB, Miami,2006
/player/marcus-maye?position=DB, Marcus Maye, S, Florida,2017
/player/marcus-mccauley?position=DB, Marcus McCauley, CB, Fresno State,2007
/player/marcus-mcclinton?position=DB, Marcus McClinton, S, Kentucky,2009
/player/marcus-paschal?position=DB, Marcus Paschal, S, Iowa,2007
/player/marcus-peters?position=DB, Marcus Peters, CB, Washington,2015
/player/marcus-ray?position=DB, Marcus Ray, S, Michigan,1999
/player/marcus-roberson?position=DB, Marcus Roberson, CB, Florida,2014
/player/marcus-trufant?position=DB, Marcus Trufant, CB, Washington State,2003
/player/marcus-walker?position=DB, Marcus Walker, CB, Oklahoma,2008
/player/marcus-washington?position=DB, Marcus Washington, S, Colorado,1999
/player/marcus-williams-2017?position=DB, Marcus Williams, S, Utah,2017
/player/marcus-winn?position=DB, Marcus Winn, S, Alabama State,2004
/player/nate-hairston?position=DB, Nate Hairston, CB, Temple,2017
/player/nate-williams?position=DB, Nate Williams, S, Washington,2011
/player/nehemiah-warrick?position=DB, Nehemiah Warrick, S, Michigan State,2008
/player/nate-salley?position=DB, Nate Salley, S, Ohio State,2006
/player/nevin-lawson?position=DB, Nevin Lawson, CB, Utah State,2014
/player/nick-collins?position=DB, Nick Collins, CB, Bethune-Cookman,2005
/player/nick-polk?position=DB, Nick Polk, S, Indiana,2010
/player/nickell-robey?position=DB, Nickell Robey, CB, USC,2013
/player/nijrell-eason?position=DB, Nijrell Eason, CB, Arizona State,2001
/player/nikia-codie?position=DB, Nikia Codie, S, Baylor,1999
/player/niles-brinkley?position=DB, Niles Brinkley, CB, Wisconsin,2011
/player/nnamdi-asomugha?position=DB, Nnamdi Asomugha, CB, California,2003
/player/norman-lejeune?position=DB, Norman LeJeune, S, LSU,2003
/player/oj-atogwe?position=DB, O.J. Atogwe, S, Stanford,2005
/player/obi-melifonwu?position=DB, Obi Melifonwu, S, Connecticut,2017
/player/omar-bolden?position=DB, Omar Bolden, CB, Arizona State,2012
/player/omare-lowe?position=DB, Omare Lowe, CB, Washington,2002
/player/orlando-scandrick?position=DB, Orlando Scandrick, CB, Boise State,2008
/player/pj-williams?position=DB, P.J. Williams, CB, Florida State,2015
/player/paris-johnson?position=DB, Paris Johnson, S, Miami (Ohio),1999
/player/ricky-thompson?position=DB, Ricky Thompson, S, Oklahoma State,1999
/player/robert-alford?position=DB, Robert Alford, CB, Southeast Louisiana,2013
/player/robert-bean?position=DB, Robert Bean, CB, Mississippi State,2000
/player/robert-blanton?position=DB, Robert Blanton, CB, Notre Dame,2012
/player/robert-carswell?position=DB, Robert Carswell, S, Clemson,2001
/player/robert-sands?position=DB, Robert Sands, S, West Virginia,2011
/player/robert-lester?position=DB, Robert Lester, S, Alabama,2013
/player/roc-alexander?position=DB, Roc Alexander, CB, Washington,2004
/player/rod-babers?position=DB, Rod Babers, CB, Texas,2003
/player/rod-sweeting?position=DB, Rod Sweeting, CB, Georgia Tech,2013
/player/rodney-crayton?position=DB, Rodney Crayton, CB, Auburn,2001
/player/rogers-beckett?position=DB, Rogers Beckett, S, Marshall,2000
/player/ron-brooks?position=DB, Ron Brooks, CB, LSU,2012
/player/ron-isreal?position=DB, Ron Isreal, S, Notre Dame,2002
/player/ronald-bartell?position=DB, Ronald Bartell, CB, Howard,2005
/player/ronald-darby?position=DB, Ronald Darby, CB, Florida State,2015
/player/rontez-miles?position=DB, Rontez Miles, S, California (PA),2013
/player/ross-cockrell?position=DB, Ross Cockrell, CB, Duke,2014
/player/roosevelt-williams?position=DB, Roosevelt Williams, CB, Tuskegee,2002
/player/roy-williams?position=DB, Roy Williams, S, Oklahoma,2002
/player/quintin-demps?position=DB, Quintin Demps, S, UTEP,2008
/player/quintin-williams?position=DB, Quintin Williams, S, Wake Forest,2004
/player/quinton-carter?position=DB, Quinton Carter, S, Oklahoma,2011
/player/rahim-moore?position=DB, Rahim Moore, S, UCLA,2011
/player/ralph-brown?position=DB, Ralph Brown, CB, Nebraska,2000
/player/randy-black?position=DB, Randy Black, S, UNLV,2001
/player/randy-jordan?position=DB, Randy Jordan, CB, Kansas State,2004
/player/rasi-dowling?position=DB, Ras-I Dowling, CB, Virginia,2011
/player/rashaad-reynolds?position=DB, Rashaad Reynolds, CB, Oregon State,2014
/player/rashad-baker?position=DB, Rashad Baker, S, Tennessee,2004
/player/rashad-bauman?position=DB, Rashad Bauman, CB, Oregon,2002
/player/rashad-carmichael?position=DB, Rashad Carmichael, CB, Virginia Tech,2011
/player/rashad-holman?position=DB, Rashad Holman, CB, Louisville,2001
/player/rashad-johnson?position=DB, Rashad Johnson, S, Alabama,2009
/player/rashad-washington?position=DB, Rashad Washington, S, Kansas State,2004
/player/rashard-anderson?position=DB, Rashard Anderson, CB, Jackson State,2000
/player/rashard-cook?position=DB, Rashard Cook, S, USC,1999
/player/rashard-robinson?position=DB, Rashard Robinson, CB, LSU,2016
/player/rashean-mathis?position=DB, Rashean Mathis, S, Bethune-Cookman,2003
/player/rashidi-barnes?position=DB, Rashidi Barnes, S, Colorado,2000
/player/rudy-ford?position=DB, Rudy Ford, S, Auburn,2017
/player/rufus-brown?position=DB, Rufus Brown, CB, Florida State,2004
/player/ryan-mouton?position=DB, Ryan Mouton, CB, Hawai'i,2009
/player/ryan-palmer?position=DB, Ryan Palmer, CB, Texas,2009
/player/ryan-smith?position=DB, Ryan Smith, CB, Florida,2007
/player/ryan-smith-2016?position=DB, Ryan Smith, CB, North Carolina Central,2016
/player/ryan-steed?position=DB, Ryan Steed, CB, Furman,2012
/player/sabby-piscitelli?position=DB, Sabby Piscitelli, S, Oregon State,2007
/player/sam-brandon?position=DB, Sam Brandon, S, UNLV,2002
/player/sammy-davis?position=DB, Sammy Davis, CB, Texas A&M,2003
/player/sanders-commings?position=DB, Sanders Commings, CB, Georgia,2013
/player/scott-shields?position=DB, Scott Shields, S, Weber State,1999
/player/scott-starks?position=DB, Scott Starks, CB, Wisconsin,2005
/player/scott-ware?position=DB, Scott Ware, S, USC,2006
/player/sean-cattouse?position=DB, Sean Cattouse, S, California,2012
/player/sean-considine?position=DB, Sean Considine, S, Iowa,2005
/player/sean-davis?position=DB, Sean Davis, CB, Maryland,2016
/player/sean-key?position=DB, Sean Key, S, Florida State,2000
/player/sean-richardson?position=DB, Sean Richardson, S, Vanderbilt,2012
/player/sean-smith?position=DB, Sean Smith, CB, Utah,2009
/player/rasul-douglas?position=DB, Rasul Douglas, CB, West Virginia,2017
/player/raymond-walls?position=DB, Raymond Walls, CB, Southern Miss,2001
/player/rayshawn--jenkins?position=DB, Rayshawn  Jenkins, S, Miami,2017
/player/reed-doughty?position=DB, Reed Doughty, S, Northern Colorado,2006
/player/reggie-austin?position=DB, Reggie Austin, CB, Wake Forest,2000
/player/reggie-lewis?position=DB, Reggie Lewis, CB, Florida,2007
/player/reggie-nelson?position=DB, Reggie Nelson, S, Florida,2007
/player/renaldo-hill?position=DB, Renaldo Hill, CB, Michigan State,2001
/player/renard-cox?position=DB, Renard Cox, CB, Maryland,2000
/player/reshad-jones?position=DB, Reshad Jones, S, Georgia,2010
/player/reuben-houston?position=DB, Reuben Houston, CB, Georgia Tech,2006
/player/ricardo-allen?position=DB, Ricardo Allen, CB, Purdue,2014
/player/ricardo-colclough?position=DB, Ricardo Colclough, CB, Tusculum,2004
/player/rich-coady?position=DB, Rich Coady, S, Texas A&M,1999
/player/rich-gardner?position=DB, Rich Gardner, CB, Penn State,2004
/player/richard-marshall?position=DB, Richard Marshall, CB, Fresno State,2006
/player/richard-newsome?position=DB, Richard Newsome, S, Michigan State,2001
/player/richard-sherman?position=DB, Richard Sherman, CB, Stanford,2011
/player/rick-sherrod?position=DB, Rick Sherrod, S, West Virginia,2002
/player/ricky-manning?position=DB, Ricky Manning, CB, UCLA,2003
/player/tyvis-powell?position=DB, Tyvis Powell, S, Ohio State,2016
/player/tyvon-branch?position=DB, Tyvon Branch, CB, Connecticut,2008
/player/vance-cuff?position=DB, Vance Cuff, CB, Georgia,2011
/player/vernon-hargreaves?position=DB, Vernon Hargreaves, CB, Florida,2016
/player/victor-hampton?position=DB, Victor Hampton, CB, South Carolina,2014
/player/victor-harris?position=DB, Victor Harris, CB, Virginia Tech,2009
/player/vincent-meeks?position=DB, Vincent Meeks, S, Texas Tech,2006
/player/vinnie-sunseri?position=DB, Vinnie Sunseri, S, Alabama,2014
/player/von-hutchins?position=DB, Von Hutchins, CB, Ole Miss,2004
/player/virgil-williams?position=DB, Virgil Williams, S, Washington State,2004
/player/vonn-bell?position=DB, Vonn Bell, S, Ohio State,2016
/player/vontae-davis?position=DB, Vontae Davis, CB, Illinois,2009
/player/vontez-duff?position=DB, Vontez Duff, CB, Notre Dame,2004
/player/wesly-mallard?position=DB, Wesly Mallard, S, Oregon,2002
/player/will-allen?position=DB, Will Allen, CB, Syracuse,2001
/player/will-blackmon?position=DB, Will Blackmon, CB, Boston College,2006
/player/will-davis-2013?position=DB, Will Davis, CB, Utah State,2013
/player/will-hill?position=DB, Will Hill, S, Florida,2011
/player/will-peterson?position=DB, Will Peterson, CB, Western Illinois,2001
/player/will-poole?position=DB, Will Poole, CB, USC,2004
/player/teez-tabor?position=DB, Teez Tabor, CB, Florida,2017
/player/terence-newman?position=DB, Terence Newman, CB, Kansas State,2003
/player/terrance-mitchell?position=DB, Terrance Mitchell, CB, Oregon,2014
/player/terreal-bierria?position=DB, Terreal Bierria, S, Georgia,2002
/player/terrell-roberts?position=DB, Terrell Roberts, CB, Oregon State,2003
/player/terrell-thomas?position=DB, Terrell Thomas, CB, USC,2008
/player/terrence-brooks?position=DB, Terrence Brooks, S, Florida State,2014
/player/terrence-frederick?position=DB, Terrence Frederick, CB, Texas A&M,2012
/player/terrence-holt?position=DB, Terrence Holt, S, NC State,2003
/player/terrence-kiel?position=DB, Terrence Kiel, S, Texas A&M,2003
/player/terrence-mcgee?position=DB, Terrence McGee, CB, Northwestern State,2003
/player/terrence-wheatley?position=DB, Terrence Wheatley, CB, Colorado,2008
/player/terry-hawthorne?position=DB, Terry Hawthorne, CB, Illinois,2013
/player/terry-holley?position=DB, Terry Holley, S, Rice,2005
/player/tevin-carter?position=DB, Tevin Carter, S, Utah,2016
/player/tevin-mcdonald?position=DB, Tevin McDonald, S, Eastern Washington,2015
/player/tharold-simon?position=DB, Tharold Simon, CB, LSU,2013
/player/thomas-davis?position=DB, Thomas Davis, S, Georgia,2005
/player/thomas-decoud?position=DB, Thomas DeCoud, S, California,2008
/player/thomas-wright?position=DB, Thomas Wright, S, Michigan State,2003
/player/stanley-wilson?position=DB, Stanley Wilson, CB, Stanford,2005
/player/stephon-gilmore?position=DB, Stephon Gilmore, CB, South Carolina,2012
/player/stephon-kelly?position=DB, Stephon Kelly, S, Winston-Salem State,2002
/player/steve-smith-2002?position=DB, Steve Smith, S, Oregon,2002
/player/steve-williams?position=DB, Steve Williams, CB, California,2013
/player/steven-nelson?position=DB, Steven Nelson, CB, Oregon State,2015
/player/stuart-schweigert?position=DB, Stuart Schweigert, S, Purdue,2004
/player/sydquan-thompson?position=DB, Syd'Quan Thompson, CB, California,2010
/player/tj-green?position=DB, T.J. Green, S, Clemson,2016
/player/tj-ward?position=DB, T.J. Ward, S, Oregon,2010
/player/tj-mcdonald?position=DB, T.J. McDonald, S, USC,2013
/player/tanard-jackson?position=DB, Tanard Jackson, S, Syracuse,2007
/player/tank-williams?position=DB, Tank Williams, S, Stanford,2002
/player/tarell-brown?position=DB, Tarell Brown, CB, Texas,2007
/player/taveze-calhoun?position=DB, Taveze Calhoun, CB, Mississippi State,2016
/player/tavon-young?position=DB, Tavon Young, CB, Temple,2016
/player/tay-cody?position=DB, Tay Cody, CB, Florida State,2001
/player/taylor-mays?position=DB, Taylor Mays, S, USC,2010
/player/taylor-reynolds?position=DB, Taylor Reynolds, CB, James Madison,2017
/player/tedric-thompson?position=DB, Tedric Thompson, S, Colorado,2017
/player/william-bartee?position=DB, William Bartee, CB, Oklahoma,2000
/player/will-redmond?position=DB, Will Redmond, CB, Mississippi State,2016
/player/william-jacksoniii?position=DB, William Jackson III, CB, Houston,2016
/player/william-likely?position=DB, William Likely, DB, Maryland,2017
/player/william-moore?position=DB, William Moore, S, Missouri,2009
/player/willie-andrews?position=DB, Willie Andrews, S, Baylor,2006
/player/willie-ford?position=DB, Willie Ford, CB, Syracuse,2002
/player/willie-middlebrooks?position=DB, Willie Middlebrooks, CB, Minnesota,2001
/player/willie-offord?position=DB, Willie Offord, S, South Carolina,2002
/player/willie-pile?position=DB, Willie Pile, S, Virginia Tech,2003
/player/wilrey-fontenot?position=DB, Wilrey Fontenot, CB, Arizona,2008
/player/winston-guy?position=DB, Winston Guy, S, Kentucky,2012
/player/xavien-howard?position=DB, Xavien Howard, CB, Baylor,2016
/player/xavier-coleman?position=DB, Xavier Coleman, CB, Portland State,2017
/player/xavier-rhodes?position=DB, Xavier Rhodes, CB, Florida State,2013
/player/xavier-woods?position=DB, Xavier Woods, S, Louisiana Tech,2017
/player/zack-sanchez?position=DB, Zack Sanchez, CB, Oklahoma,2016
/player/zackary-bowman?position=DB, Zackary Bowman, CB, Nebraska,2008
/player/zeke-motta?position=DB, Zeke Motta, S, Notre Dame,2013
/player/sedrick-curry?position=DB, Sedrick Curry, CB, Texas A&M,2000
/player/senquez-golson?position=DB, Senquez Golson, CB, Ole Miss,2015
/player/shalom-luani?position=DB, Shalom Luani, S, Washington State,2017
/player/shamarko-thomas?position=DB, Shamarko Thomas, S, Syracuse,2013
/player/shane-walton?position=DB, Shane Walton, CB, Notre Dame,2003
/player/shaquill-griffin?position=DB, Shaquill Griffin, DB, UCF,2017
/player/shareece-wright?position=DB, Shareece Wright, CB, USC,2011
/player/shaun-prater?position=DB, Shaun Prater, CB, Iowa,2012
/player/shaunard-harts?position=DB, Shaunard Harts, S, Boise State,2001
/player/shawn-forte?position=DB, Shawn Forte, S, Maryland,2001
/player/shawn-williams?position=DB, Shawn Williams, S, Georgia,2013
/player/sheldon-brown?position=DB, Sheldon Brown, CB, South Carolina,2002
/player/sherrod-martin?position=DB, Sherrod Martin, CB, Troy,2009
/player/shiloh-keo?position=DB, Shiloh Keo, S, Idaho,2011
/player/sidney-jones?position=DB, Sidney Jones, CB, Washington,2017
/player/simeon-castille?position=DB, Simeon Castille, S, Alabama,2008
/player/sojourn-shelton?position=DB, Sojourn Shelton, CB, Wisconsin,2017
/player/sori-kanu?position=DB, Sori Kanu, S, Michigan State,1999
/player/stanford-routt?position=DB, Stanford Routt, CB, Houston,2005
/player/stanley-jeanbaptiste?position=DB, Stanley Jean-Baptiste, CB, Nebraska,2014
/player/tim-jennings?position=DB, Tim Jennings, CB, Georgia,2006
/player/tinker-keck?position=DB, Tinker Keck, S, Cincinnati,2000
/player/todd-franz?position=DB, Todd Franz, S, Tulsa,2000
/player/todd-johnson?position=DB, Todd Johnson, S, Florida,2003
/player/todd-washington?position=DB, Todd Washington, CB, Southeast Louisiana,2014
/player/tom-zbikowski?position=DB, Tom Zbikowski, S, Notre Dame,2008
/player/tony-beckham?position=DB, Tony Beckham, CB, Wisconsin-Stout,2002
/player/tony-bua?position=DB, Tony Bua, S, Arkansas,2004
/player/tony-dixon?position=DB, Tony Dixon, S, Alabama,2001
/player/tony-george?position=DB, Tony George, S, Florida,1999
/player/tony-jefferson?position=DB, Tony Jefferson, S, Oklahoma,2013
/player/tony-okanlawon?position=DB, Tony Okanlawon, CB, Maryland,2002
/player/tony-scott?position=DB, Tony Scott, CB, NC State,2000
/player/torrie-cox?position=DB, Torrie Cox, CB, Pittsburgh,2003
/player/tracy-porter?position=DB, Tracy Porter, CB, Indiana,2008
/player/trae-waynes?position=DB, Trae Waynes, CB, Michigan State,2015
/player/trae-williams?position=DB, Trae Williams, CB, South Florida,2008
/player/travares-tillman?position=DB, Travares Tillman, S, Georgia Tech,2000
/player/travarous-bain?position=DB, Travarous Bain, CB, Hampton,2007
/player/travis-carrie?position=DB, Travis Carrie, CB, Ohio,2014
/player/travis-daniels?position=DB, Travis Daniels, CB, LSU,2005
/player/tre-boston?position=DB, Tre  Boston, S, North Carolina,2014
/player/tredavious-white?position=DB, Tre'Davious White, CB, LSU,2017
/player/trent-gamble?position=DB, Trent Gamble, S, Wyoming,2000
/player/trenton-robinson?position=DB, Trenton Robinson, S, Michigan State,2012
/player/treston-decoud?position=DB, Treston Decoud, CB, Oregon State,2017
/player/trevard-lindley?position=DB, Trevard Lindley, CB, Kentucky,2010
/player/trevin-wade?position=DB, Trevin Wade, CB, Arizona,2012
/player/troy-hill?position=DB, Troy Hill, CB, Oregon,2015
/player/troy-nolan?position=DB, Troy Nolan, S, Arizona State,2009
/player/trumaine-johnson?position=DB, Trumaine Johnson, CB, Montana,2012
/player/trumaine-mcbride?position=DB, Trumaine McBride, CB, Ole Miss,2007
/player/ty-talton?position=DB, Ty Talton, CB, Northern Iowa,1999
/player/tye-hill?position=DB, Tye Hill, CB, Clemson,2006
/player/tye-smith?position=DB, Tye Smith, CB, Towson,2015
/player/tyler-sash?position=DB, Tyler Sash, S, Iowa,2011
/player/tyrann-mathieu?position=DB, Tyrann Mathieu, CB, LSU,2013
/player/tyrell-johnson?position=DB, Tyrell Johnson, S, Arkansas State,2008
/player/tyron-brackenridge?position=DB, Tyron Brackenridge, CB, Washington State,2007
/player/tyrone-carter?position=DB, Tyrone Carter, S, Minnesota,2000