/player/aj-jefferson?position=DB, A.J. Jefferson, CB, Fresno State,2010
/player/aaron-colvin?position=DB, Aaron Colvin, CB, Oklahoma,2014
/player/aj-stamps?position=DB, A.J. Stamps, S, Kentucky,2016
/player/aaron-francisco?position=DB, Aaron Francisco, S, BYU,2005
/player/aaron-hester?position=DB, Aaron Hester, CB, UCLA,2013
/player/aaron-ross?position=DB, Aaron Ross, CB, Texas,2007
/player/aaron-rouse?position=DB, Aaron Rouse, S, Virginia Tech,2007
/player/aaron-williams-2011?position=DB, Aaron Williams, CB, Texas,2011
/player/abdual-howard?position=DB, Abdual Howard, S, Florida State,2002
/player/abraham-elimimian?position=DB, Abraham Elimimian, CB, Hawai'i,2005
/player/adam-archuleta?position=DB, Adam Archuleta, S, Arizona State,2001
/player/adoree-jackson?position=DB, Adoree' Jackson, CB, USC,2017
/player/adrian-amos?position=DB, Adrian Amos, S, Penn State,2015
/player/adrian-bushell?position=DB, Adrian Bushell, CB, Louisville,2013
/player/adrian-wilson?position=DB, Adrian Wilson, S, NC State,2001
/player/ahkello-witherspoon?position=DB, Ahkello Witherspoon, CB, Colorado,2017
/player/ahmad-black?position=DB, Ahmad Black, S, Florida,2011
/player/ahmad-carroll?position=DB, Ahmad Carroll, CB, Arkansas,2004
/player/ahmad-dixon?position=DB, Ahmad Dixon, S, Baylor,2014
/player/akwasi-owusuansah?position=DB, Akwasi Owusu-Ansah, CB, Indiana (PA),2010
/player/alex-carter?position=DB, Alex Carter, CB, Stanford,2015
/player/alfonzo-dennard?position=DB, Alfonzo Dennard, CB, Nebraska,2012
/player/alphonso-hodge?position=DB, Alphonso Hodge, CB, Miami (Ohio),2005
/player/alphonso-smith?position=DB, Alphonso Smith, CB, Wake Forest,2009
/player/alterraun-verner?position=DB, Alterraun Verner, CB, UCLA,2010
/player/amari-spievey?position=DB, Amari Spievey, CB, Iowa,2010
/player/andre-hal?position=DB, Andre Hal, CB, Vanderbilt,2014
/player/andre-holland?position=DB, Andre Holland, CB, Oregon State,1999
/player/andre-maddox?position=DB, Andre Maddox, S, NC State,2005
/player/andre-weathers?position=DB, Andre Weathers, CB, Michigan,1999
/player/andre-woolfolk?position=DB, Andre Woolfolk, CB, Oklahoma,2003
/player/andrew-mcgee?position=DB, Andrew McGee, CB, Oklahoma State,2011
/player/anthony-arline?position=DB, Anthony Arline, CB, Baylor,2007
/player/anthony-brown?position=DB, Anthony Brown, CB, Purdue,2016
/player/anthony-floyd?position=DB, Anthony Floyd, S, Louisville,2003
/player/anthony-harris?position=DB, Anthony Harris, S, Virginia,2015
/player/anthony-henry?position=DB, Anthony Henry, CB, South Florida,2001
/player/anthony-jefferson?position=DB, Anthony Jefferson, CB, UCLA,2015
/player/anthony-malbrough?position=DB, Anthony Malbrough, CB, Texas Tech,2000
/player/anthony-parker?position=DB, Anthony Parker, CB, Weber State,1999
/player/brandon-ghee?position=DB, Brandon Ghee, CB, Wake Forest,2010
/player/brandon-harris?position=DB, Brandon Harris, CB, Miami,2011
/player/brandon-hogan?position=DB, Brandon Hogan, CB, West Virginia,2011
/player/brandon-hughes?position=DB, Brandon Hughes, CB, Oregon State,2009
/player/brandon-jennings?position=DB, Brandon Jennings, S, Texas A&M,2000
/player/brandon-mcdonald?position=DB, Brandon McDonald, CB, Memphis,2007
/player/brandon-mcgee?position=DB, Brandon McGee, CB, Miami,2013
/player/brandon-meriweather?position=DB, Brandon Meriweather, S, Miami,2007
/player/brandon-sharp?position=DB, Brandon Sharp, S, Louisville,2007
/player/brandon-sumrall?position=DB, Brandon Sumrall, CB, Southern Miss,2008
/player/brandon-taylor?position=DB, Brandon Taylor, S, LSU,2012
/player/brandon-underwood?position=DB, Brandon Underwood, S, Cincinnati,2009
/player/brandon-williams-2016?position=DB, Brandon Williams, CB, Texas A&M,2016
/player/brandyn-thompson?position=DB, Brandyn Thompson, CB, Boise State,2011
/player/brendan-langley?position=DB, Brendan Langley, CB, Lamar,2017
/player/brian-allen-2017?position=DB, Brian Allen, DB, Utah,2017
/player/brian-bonner?position=DB, Brian Bonner, S, TCU,2008
/player/brian-gray?position=DB, Brian Gray, CB, BYU,2000
/player/brian-jackson?position=DB, Brian Jackson, CB, Oklahoma,2010
/player/brian-mance?position=DB, Brian Mance, CB, Clemson,2003
/player/darnell-terrell?position=DB, Darnell Terrell, CB, Missouri,2008
/player/darqueze-dennard?position=DB, Darqueze Dennard, CB, Michigan State,2014
/player/darrell-brooks?position=DB, Darrell Brooks, S, Arizona,2006
/player/darrell-hunter?position=DB, Darrell Hunter, CB, Miami (Ohio),2006
/player/darrell-stuckey?position=DB, Darrell Stuckey, S, Kansas,2010
/player/darrent-williams?position=DB, Darrent Williams, CB, Oklahoma State,2005
/player/darrick-vaughn?position=DB, Darrick Vaughn, CB, Texas State,2000
/player/daryl-dixon?position=DB, Daryl Dixon, S, Florida,2004
/player/daryl-worley?position=DB, Daryl Worley, CB, West Virginia,2016
/player/dashon-goldson?position=DB, Dashon Goldson, S, Washington,2007
/player/david-amerson?position=DB, David Amerson, CB, NC State,2013
/player/david-barrett?position=DB, David Barrett, CB, Arkansas,2000
/player/david-bruton?position=DB, David Bruton, S, Notre Dame,2009
/player/david-byrd?position=DB, David Byrd, CB, Syracuse,2000
/player/daven-holly?position=DB, Daven Holly, CB, Cincinnati,2005
/player/david-irons?position=DB, David Irons, CB, Auburn,2007
/player/david-macklin?position=DB, David Macklin, CB, Penn State,2000
/player/david-pender?position=DB, David Pender, CB, Purdue,2010
/player/david-pittman?position=DB, David Pittman, CB, Northwestern State,2006
/player/david-roach?position=DB, David Roach, S, TCU,2008
/player/craig-loston?position=DB, Craig Loston, S, LSU,2014
/player/craig-mager?position=DB, Craig Mager, CB, Texas State,2015
/player/crezdon-butler?position=DB, Crezdon Butler, CB, Clemson,2010
/player/curry-burns?position=DB, Curry Burns, S, Louisville,2003
/player/curtis-brown?position=DB, Curtis Brown, CB, Texas,2011
/player/curtis-deloatch?position=DB, Curtis DeLoatch, CB, North Carolina A&T,2004
/player/curtis-fuller?position=DB, Curtis Fuller, S, TCU,2001
/player/curtis-marsh?position=DB, Curtis Marsh, CB, Utah State,2011
/player/curtis-taylor?position=DB, Curtis Taylor, S, LSU,2009
/player/cyhl-quarles?position=DB, Cyhl Quarles, S, Wake Forest,2012
/player/cyrus-jones?position=DB, Cyrus Jones, CB, Alabama,2016
/player/danton-lynn?position=DB, D'Anton Lynn, CB, Penn State,2012
/player/djoun-smith?position=DB, D'Joun Smith, CB, Florida Atlantic,2015
/player/dj-hayden?position=DB, D.J. Hayden, CB, Houston,2013
/player/dj-moore?position=DB, D.J. Moore, CB, Vanderbilt,2009
/player/dj-parker?position=DB, D.J. Parker, S, Virginia Tech,2008
/player/dj-swearinger?position=DB, D.J. Swearinger, S, South Carolina,2013
/player/dj-white?position=DB, D.J. White, CB, Georgia Tech,2016
/player/dj-wolfe?position=DB, D.J. Wolfe, S, Oklahoma,2008
/player/danorris-searcy?position=DB, Da'Norris Searcy, S, North Carolina,2011
/player/cleveland-wallace?position=DB, Cleveland Wallace, CB, San Jose State,2016
/player/cliff-harris?position=DB, Cliff Harris, CB, Oregon,2012
/player/cody-grimm?position=DB, Cody Grimm, S, Virginia Tech,2010
/player/cody-prewitt?position=DB, Cody Prewitt, S, Ole Miss,2015
/player/colin-branch?position=DB, Colin Branch, S, Stanford,2003
/player/cordrea-tankersley?position=DB, Cordrea Tankersley, CB, Clemson,2017
/player/corey-hall?position=DB, Corey Hall, S, Appalachian State,2001
/player/corey-webster?position=DB, Corey Webster, CB, LSU,2005
/player/corey-white?position=DB, Corey White, S, Samford,2012
/player/corn-elder?position=DB, Corn Elder, CB, Miami,2017
/player/cornelius-brown?position=DB, Cornelius Brown, CB, UTEP,2010
/player/cortez-allen?position=DB, Cortez Allen, CB, Citadel,2011
/player/cory-bird?position=DB, Cory Bird, S, Virginia Tech,2001
/player/cory-hall?position=DB, Cory Hall, S, Fresno State,1999
/player/coryell-judie?position=DB, Coryell Judie, CB, Texas A&M,2012
/player/coty-sensabaugh?position=DB, Coty Sensabaugh, CB, Clemson,2012
/player/courtney-greene?position=DB, Courtney Greene, S, Rutgers,2009
/player/coy-wire?position=DB, Coy Wire, S, Stanford,2002
/player/coye-francies?position=DB, Coye Francies, CB, San Jose State,2009
/player/craig-dahl?position=DB, Craig Dahl, S, North Dakota State,2007
/player/anthony-smith?position=DB, Anthony Smith, S, Syracuse,2006
/player/antoine-bethea?position=DB, Antoine Bethea, S, Howard,2006
/player/antoine-cason?position=DB, Antoine Cason, CB, Arizona,2008
/player/antoine-winfield?position=DB, Antoine Winfield, CB, Ohio State,1999
/player/antone-exum?position=DB, Antone Exum, CB, Virginia Tech,2014
/player/antonio-allen?position=DB, Antonio Allen, S, South Carolina,2012
/player/antonio-cromartie?position=DB, Antonio Cromartie, CB, Florida State,2006
/player/antonio-fenelus?position=DB, Antonio Fenelus, CB, Wisconsin,2012
/player/antonio-malone?position=DB, Antonio Malone, CB, Toledo,2006
/player/antonio-perkins?position=DB, Antonio Perkins, CB, Oklahoma,2005
/player/antrel-rolle?position=DB, Antrel Rolle, CB, Miami,2005
/player/antuan-edwards?position=DB, Antuan Edwards, S, Clemson,1999
/player/antwan-harris?position=DB, Antwan Harris, CB, Virginia,2000
/player/antwaun-molden?position=DB, Antwaun Molden, CB, Eastern Kentucky,2008
/player/antwoine-sanders?position=DB, Antwoine Sanders, S, Utah,2003
/player/antwuan-reed?position=DB, Antwuan Reed, CB, Pittsburgh,2012
/player/aqib-talib?position=DB, Aqib Talib, CB, Kansas,2008
/player/aric-morris?position=DB, Aric Morris, S, Michigan State,2000
/player/aric-williams?position=DB, Aric Williams, CB, Oregon State,2005
/player/armon-hatcher?position=DB, Armon Hatcher, S, Oregon State,1999
/player/captain-munnerlyn?position=DB, Captain Munnerlyn, CB, South Carolina,2009
/player/carey-scott?position=DB, Carey Scott, CB, Kentucky State,2001
/player/carl-nesmith?position=DB, Carl Nesmith, S, Kansas,2001
/player/carlos-rogers?position=DB, Carlos Rogers, CB, Auburn,2005
/player/cary-harris?position=DB, Cary Harris, CB, USC,2009
/player/casey-hayward?position=DB, Casey Hayward, CB, Vanderbilt,2012
/player/cato-june?position=DB, Cato June, S, Michigan,2003
/player/cedric-griffin?position=DB, Cedric Griffin, S, Texas,2006
/player/cedrick-williams?position=DB, Cedrick Williams, CB, Kansas State,2005
/player/chad-jones?position=DB, Chad Jones, S, LSU,2010
/player/chad-nkang?position=DB, Chad Nkang, S, Missouri,2007
/player/chad-williams?position=DB, Chad Williams, S, Southern Miss,2002
/player/champ-bailey?position=DB, Champ Bailey, CB, Georgia,1999
/player/channing-stribling?position=DB, Channing Stribling, CB, Michigan,2017
/player/charles-brown-2012?position=DB, Charles Brown, CB, North Carolina,2012
/player/charles-drake?position=DB, Charles Drake, S, Michigan,2003
/player/charles-fisher?position=DB, Charles Fisher, CB, West Virginia,1999
/player/charles-gaines?position=DB, Charles Gaines, CB, Louisville,2015
/player/charles-godfrey?position=DB, Charles Godfrey, CB, Iowa,2008
/player/charles-gordon?position=DB, Charles Gordon, CB, Kansas,2006
/player/derek-pegues?position=DB, Derek Pegues, S, Mississippi State,2009
/player/derrick-gibson?position=DB, Derrick Gibson, S, Florida State,2001
/player/derrick-johnson-2005?position=DB, Derrick Johnson, CB, Texas,2005
/player/derrick-kindred?position=DB, Derrick Kindred, S, TCU,2016
/player/derrick-martin?position=DB, Derrick Martin, CB, Wyoming,2006
/player/derron-smith?position=DB, Derron Smith, S, Fresno State,2015
/player/deshone-mallard?position=DB, Deshone Mallard, CB, Southern Miss,1999
/player/desmond-king?position=DB, Desmond King, S, Iowa,2017
/player/desmond-trufant?position=DB, Desmond Trufant, CB, Washington,2013
/player/detrick-bonner?position=DB, Detrick Bonner, S, Virginia Tech,2015
/player/devin-chappell?position=DB, Devin Chappell, S, Oregon State,2017
/player/devin-mccourty?position=DB, Devin McCourty, CB, Rutgers,2010
/player/devin-ross?position=DB, Devin Ross, CB, Arizona,2010
/player/devon-torrence?position=DB, Devon Torrence, CB, Ohio State,2011
/player/dexter-jackson?position=DB, Dexter Jackson, S, Florida State,1999
/player/dexter-mcdougle?position=DB, Dexter McDougle, CB, Maryland,2014
/player/dexter-wynn?position=DB, Dexter Wynn, CB, Colorado State,2004
/player/dezmen-southward?position=DB, Dezmen Southward, S, Wisconsin,2014
/player/diamond-ferri?position=DB, Diamond Ferri, S, Syracuse,2005
/player/dion-bailey?position=DB, Dion Bailey, S, USC,2014
/player/charles-mitchell?position=DB, Charles Mitchell, S, Mississippi State,2012
/player/charles-tillman?position=DB, Charles Tillman, CB, Louisiana-Lafayette,2003
/player/charlie-peprah?position=DB, Charlie Peprah, S, Alabama,2006
/player/chase-minnifield?position=DB, Chase Minnifield, CB, Virginia,2012
/player/chaz-powell?position=DB, Chaz Powell, CB, Penn State,2012
/player/chaz-williams?position=DB, Chaz Williams, CB, Louisiana-Monroe,2007
/player/chevis-jackson?position=DB, Chevis Jackson, CB, LSU,2008
/player/chidobe-awuzie?position=DB, Chidobe Awuzie, CB, Colorado,2017
/player/chijioke-onyenegecha?position=DB, Chijioke Onyenegecha, CB, Oklahoma,2006
/player/chimdi-chekwa?position=DB, Chimdi Chekwa, CB, Ohio State,2011
/player/chinedum-ndukwe?position=DB, Chinedum Ndukwe, S, Notre Dame,2007
/player/chip-vaughn?position=DB, Chip Vaughn, S, Wake Forest,2009
/player/chris-brown-2003?position=DB, Chris Brown, S, Hawai'i,2003
/player/chris-chancellor?position=DB, Chris Chancellor, CB, Clemson,2010
/player/chris-clemons-2009?position=DB, Chris Clemons, S, Clemson,2009
/player/chris-conte?position=DB, Chris Conte, S, California,2011
/player/chris-cook?position=DB, Chris Cook, CB, Virginia,2010
/player/chris-culliver?position=DB, Chris Culliver, S, South Carolina,2011
/player/chris-cummings?position=DB, Chris Cummings, CB, LSU,1999
/player/chris-davis-2014?position=DB, Chris Davis, CB, Auburn,2014
/player/david-sims?position=DB, David Sims, S, Iowa State,2011
/player/davon-house?position=DB, Davon House, CB, New Mexico State,2011
/player/dawan-landry?position=DB, Dawan Landry, S, Georgia Tech,2006
/player/daxton-swanson?position=DB, Daxton Swanson, CB, Sam Houston State,2013
/player/daylon-mccutcheon?position=DB, Daylon McCutcheon, CB, USC,1999
/player/daymeion-hughes?position=DB, Daymeion Hughes, CB, California,2007
/player/devante-harris?position=DB, De'Vante Harris, CB, Texas A&M,2016
/player/deandre-eiland?position=DB, DeAndre Eiland, S, South Carolina,2004
/player/deandre-elliott?position=DB, DeAndre Elliott, CB, Colorado State,2016
/player/deandre-houstoncarson?position=DB, DeAndre Houston-Carson, S, William & Mary,2016
/player/deandre-mcdaniel?position=DB, DeAndre McDaniel, S, Clemson,2011
/player/deandre-presley?position=DB, DeAndre Presley, CB, Appalachian State,2012
/player/deandre-wright?position=DB, DeAndre Wright, CB, New Mexico,2009
/player/deangelo-hall?position=DB, DeAngelo Hall, CB, Virginia Tech,2004
/player/deangelo-smith?position=DB, DeAngelo Smith, CB, Cincinnati,2009
/player/dejon-gomes?position=DB, DeJon Gomes, S, Nebraska,2011
/player/dejuan-groce?position=DB, DeJuan Groce, CB, Nebraska,2003
/player/dejuan-tribble?position=DB, DeJuan Tribble, CB, Boston College,2008
/player/demario-minter?position=DB, DeMario Minter, CB, Georgia,2006
/player/dequan-menzie?position=DB, DeQuan Menzie, CB, Alabama,2012
/player/dean-marlowe?position=DB, Dean Marlowe, S, James Madison,2015
/player/dee-mccann?position=DB, Dee McCann, CB, West Virginia,2006
/player/dee-milliner?position=DB, Dee Milliner, CB, Alabama,2013
/player/dee-moronkola?position=DB, Dee Moronkola, CB, Washington State,1999
/player/dee-webb?position=DB, Dee Webb, CB, Florida,2006
/player/deion-belue?position=DB, Deion Belue, CB, Alabama,2014
/player/deiondre-hall?position=DB, Deiondre' Hall, CB, Northern Iowa,2016
/player/delano-hill?position=DB, Delano Hill, S, Michigan,2017
/player/delano-howell?position=DB, Delano Howell, S, Stanford,2012
/player/demarcus-faggins?position=DB, Demarcus Faggins, CB, Kansas State,2002
/player/demarcus-vandyke?position=DB, Demarcus Van Dyke, CB, Miami,2011
/player/demetri-goodson?position=DB, Demetri Goodson, CB, Baylor,2014
/player/demetrius-mccray?position=DB, Demetrius McCray, CB, Appalachian State,2013
/player/dennis-keyes?position=DB, Dennis Keyes, S, UCLA,2008
/player/dennis-rogan?position=DB, Dennis Rogan, S, Tennessee,2010
/player/dennis-weathersby?position=DB, Dennis Weathersby, CB, Oregon State,2003
/player/deon-bush?position=DB, Deon Bush, S, Miami,2016
/player/deon-grant?position=DB, Deon Grant, S, Tennessee,2000
/player/deone-bucannon?position=DB, Deone Bucannon, S, Washington State,2014
/player/derek-pagel?position=DB, Derek Pagel, S, Iowa,2003
/player/duke-ihenacho?position=DB, Duke Ihenacho, S, San Jose State,2012
/player/dunta-robinson?position=DB, Dunta Robinson, CB, South Carolina,2004
/player/durell-eskridge?position=DB, Durell Eskridge, S, Syracuse,2015
/player/duron-harmon?position=DB, Duron Harmon, S, Rutgers,2013
/player/dustin-fox?position=DB, Dustin Fox, S, Ohio State,2005
/player/dwayne-gratz?position=DB, Dwayne Gratz, CB, Connecticut,2013
/player/dwayne-slay?position=DB, Dwayne Slay, S, Texas Tech,2006
/player/dwight-bentley?position=DB, Dwight Bentley, CB, Louisiana-Lafayette,2012
/player/dwight-lowery?position=DB, Dwight Lowery, CB, San Jose State,2008
/player/dwight-smith?position=DB, Dwight Smith, CB, Akron,2001
/player/dwyte-smiley?position=DB, Dwyte Smiley, S, Youngstown State,2000
/player/ej-gaines?position=DB, E.J. Gaines, CB, Missouri,2014
/player/earl-thomas?position=DB, Earl Thomas, CB, Texas,2010
/player/earl-wolff?position=DB, Earl Wolff, S, NC State,2013
/player/ed-reynolds?position=DB, Ed Reynolds, S, Stanford,2014
/player/eddie-jackson?position=DB, Eddie Jackson, S, Alabama,2017
/player/eddie-pleasant?position=DB, Eddie Pleasant, S, Oregon,2012
/player/eli-apple?position=DB, Eli Apple, CB, Ohio State,2016
/player/elijah-shumate?position=DB, Elijah Shumate, S, Notre Dame,2016
/player/ellis-hobbs?position=DB, Ellis Hobbs, CB, Iowa State,2005
/player/arnold-parker?position=DB, Arnold Parker, S, Utah,2004
/player/art-maulet?position=DB, Art Maulet, DB, Memphis,2017
/player/artie-burns?position=DB, Artie Burns, CB, Miami,2016
/player/arturo-freeman?position=DB, Arturo Freeman, S, South Carolina,2000
/player/asa-jackson?position=DB, Asa Jackson, CB, Cal Poly,2012
/player/asante-samuel?position=DB, Asante Samuel, CB, UCF,2003
/player/asher-allen?position=DB, Asher Allen, CB, Georgia,2009
/player/ashley-cooper?position=DB, Ashley Cooper, S, Mississippi State,2000
/player/ashton-lampkin?position=DB, Ashton Lampkin, CB, Oklahoma State,2017
/player/atari-bigby?position=DB, Atari Bigby, S, UCF,2005
/player/atcheson-conway?position=DB, Atcheson Conway, S, Bowie State,2005
/player/bj-tucker?position=DB, B.J. Tucker, CB, Wisconsin,2003
/player/bw-webb?position=DB, B.W. Webb, CB, William & Mary,2013
/player/barry-church?position=DB, Barry Church, S, Toledo,2010
/player/bashaud-breeland?position=DB, Bashaud Breeland, CB, Clemson,2014
/player/bacarri-rambo?position=DB, Bacarri Rambo, S, Georgia,2013
/player/ben-emanuel?position=DB, Ben Emanuel, S, UCLA,2005
/player/ben-kelly?position=DB, Ben Kelly, CB, Colorado,2000
/player/bene-benwikere?position=DB, Bene  Benwikere, CB, San Jose State,2014
/player/bennett-jackson?position=DB, Bennett Jackson, CB, Notre Dame,2014
/player/brian-williams?position=DB, Brian Williams, CB, NC State,2002
/player/briean-boddycalhoun?position=DB, Briean Boddy-Calhoun, CB, Minnesota,2016
/player/brock-vereen?position=DB, Brock Vereen, S, Minnesota,2014
/player/brock-williams?position=DB, Brock Williams, CB, Notre Dame,2001
/player/bruce-branch?position=DB, Bruce Branch, CB, Penn State,2002
/player/bruce-johnson?position=DB, Bruce Johnson, CB, Miami,2009
/player/bruce-thornton?position=DB, Bruce Thornton, CB, Georgia,2004
/player/bryan-scott?position=DB, Bryan Scott, S, Penn State,2003
/player/bryant-mcfadden?position=DB, Bryant McFadden, CB, Florida State,2005
/player/budda-baker?position=DB, Budda Baker, S, Washington,2017
/player/buster-skrine?position=DB, Buster Skrine, CB, Tennessee-Chattanooga,2011
/player/byron-jones?position=DB, Byron Jones, CB, Connecticut,2015
/player/byron-maxwell?position=DB, Byron Maxwell, CB, Clemson,2011
/player/cj-gaddis?position=DB, C.J. Gaddis, S, Clemson,2007
/player/cj-spillman?position=DB, C.J. Spillman, S, Marshall,2009
/player/cj-wilson?position=DB, C.J. Wilson, CB, Baylor,2007
/player/calvin-lowry?position=DB, Calvin Lowry, S, Penn State,2006
/player/caleb-campbell?position=DB, Caleb Campbell, S, Army,2008
/player/calvin-pryor?position=DB, Calvin Pryor, S, Louisville,2014
/player/cameron-sutton?position=DB, Cameron Sutton, CB, Tennessee,2017
/player/emanuel-cook?position=DB, Emanuel Cook, S, South Carolina,2009
/player/emile-white?position=DB, Emile White, S, Houston,2001
/player/eric-berry?position=DB, Eric Berry, S, Tennessee,2010
/player/eric-edwards?position=DB, Eric Edwards, CB, Oregon,1999
/player/eric-frampton?position=DB, Eric Frampton, S, Washington State,2007
/player/eric-green?position=DB, Eric Green, CB, Virginia Tech,2005
/player/eric-hagg?position=DB, Eric Hagg, S, Nebraska,2011
/player/eric-johnson?position=DB, Eric Johnson, S, Nebraska,2000
/player/eric-joyce?position=DB, Eric Joyce, CB, Tennessee State,2002
/player/eric-kelly?position=DB, Eric Kelly, CB, Kentucky,2001
/player/eric-king-2005?position=DB, Eric King, CB, Wake Forest,2005
/player/eric-murray?position=DB, Eric Murray, CB, Minnesota,2016
/player/eric-reid?position=DB, Eric Reid, S, LSU,2013
/player/eric-rowe?position=DB, Eric Rowe, CB, Utah,2015
/player/eric-smith?position=DB, Eric Smith, S, Michigan State,2006
/player/eric-thigpen?position=DB, Eric Thigpen, S, Iowa,1999
/player/eric-weddle?position=DB, Eric Weddle, S, Utah,2007
/player/eric-wright?position=DB, Eric Wright, CB, UNLV,2007
/player/erik-coleman?position=DB, Erik Coleman, S, Washington State,2004
/player/erik-olson?position=DB, Erik Olson, S, Colorado,2000
/player/bernard-pollard?position=DB, Bernard Pollard, S, Purdue,2006
/player/billy-gustin?position=DB, Billy Gustin, S, Purdue,1999
/player/bhawoh-jue?position=DB, Bhawoh Jue, CB, Penn State,2001
/player/blidi-wrehwilson?position=DB, Blidi Wreh-Wilson, CB, Connecticut,2013
/player/bo-smith?position=DB, Bo Smith, CB, Weber State,2007
/player/bob-sanders?position=DB, Bob Sanders, S, Iowa,2004
/player/bobby-gray?position=DB, Bobby Gray, S, Louisiana Tech,2002
/player/bobby-jackson?position=DB, Bobby Jackson, S, Illinois,2002
/player/bobby-mccain?position=DB, Bobby McCain, CB, Memphis,2015
/player/bobby-myers?position=DB, Bobby Myers, S, Wisconsin,2000
/player/bobby-sippio?position=DB, Bobby Sippio, CB, Western Kentucky,2002
/player/brad-ware?position=DB, Brad Ware, S, Auburn,1999
/player/bradley-fletcher?position=DB, Bradley Fletcher, CB, Iowa,2009
/player/bradley-mcdougald?position=DB, Bradley McDougald, S, Kansas,2013
/player/bradley-roby?position=DB, Bradley Roby, CB, Ohio State,2014
/player/brandon-boykin?position=DB, Brandon Boykin, CB, Georgia,2012
/player/brandon-browner?position=DB, Brandon Browner, CB, Oregon State,2005
/player/brandon-burton?position=DB, Brandon Burton, CB, Utah,2011
/player/brandon-dixon?position=DB, Brandon Dixon, CB, Northwest Missouri State,2014
/player/brandon-flowers?position=DB, Brandon Flowers, CB, Virginia Tech,2008
/player/dominique-barber?position=DB, Dominique Barber, S, Minnesota,2008
/player/dominique-franks?position=DB, Dominique Franks, CB, Oklahoma,2010
/player/dominique-rodgerscromartie?position=DB, Dominique Rodgers-Cromartie, CB, Tennessee State,2008
/player/domonique-foxworth?position=DB, Domonique Foxworth, CB, Maryland,2005
/player/domonique-johnson?position=DB, Domonique Johnson, CB, Jackson State,2009
/player/don-carey?position=DB, Don Carey, CB, Norfolk State,2009
/player/donald-celiscar?position=DB, Donald Celiscar, CB, Western Michigan,2015
/player/donald-mitchell?position=DB, Donald Mitchell, CB, SMU,1999
/player/donald-strickland?position=DB, Donald Strickland, CB, Colorado,2003
/player/donald-washington?position=DB, Donald Washington, CB, Ohio State,2009
/player/donnie-nickey?position=DB, Donnie Nickey, S, Ohio State,2003
/player/donovan-warren?position=DB, Donovan Warren, S, Michigan,2010
/player/dontae-johnson?position=DB, Dontae Johnson, S, NC State,2014
/player/donte-nicholson?position=DB, Donte Nicholson, S, Oklahoma,2005
/player/donte-whitner?position=DB, Donte Whitner, S, Ohio State,2006
/player/doran-grant?position=DB, Doran Grant, CB, Ohio State,2015
/player/drayton-florence?position=DB, Drayton Florence, CB, Tuskegee,2003
/player/dre-kirkpatrick?position=DB, Dre Kirkpatrick, CB, Alabama,2012
/player/dre-bly?position=DB, Dre' Bly, CB, North Carolina,1999
/player/duane-coleman?position=DB, Duane Coleman, CB, Clemson,2007
/player/dajuan-morgan?position=DB, DaJuan Morgan, S, NC State,2008
/player/daimion-stafford?position=DB, Daimion Stafford, S, Nebraska,2013
/player/damarious-randall?position=DB, Damarious Randall, S, Arizona State,2015
/player/damarius-travis?position=DB, Damarius Travis, S, Minnesota,2017
/player/damian-swann?position=DB, Damian Swann, CB, Georgia,2015
/player/damon-moore?position=DB, Damon Moore, S, Ohio State,1999
/player/damon-wheeler?position=DB, Damon Wheeler, CB, Colorado,2000
/player/damontae-kazee?position=DB, Damontae Kazee, CB, San Diego State,2017
/player/dan-dawson?position=DB, Dan Dawson, S, Rice,2002
/player/danieal-manning?position=DB, Danieal Manning, CB, Abilene Christian,2006
/player/daniel-bullocks?position=DB, Daniel Bullocks, S, Nebraska,2006
