/player/daniel-sorensen?position=DB, Daniel Sorensen, S, BYU,2014
/player/dante-wesley?position=DB, Dante Wesley, CB, Arkansas-Pine Bluff,2002
/player/darcel-mcbath?position=DB, Darcel McBath, S, Texas Tech,2009
/player/daren-stone?position=DB, Daren Stone, S, Maine,2007
/player/darian-stewart?position=DB, Darian Stewart, S, South Carolina,2010
/player/darian-thompson?position=DB, Darian Thompson, S, Boise State,2016
/player/darius-butler?position=DB, Darius Butler, CB, Connecticut,2009
/player/darius-slay?position=DB, Darius Slay, CB, Mississippi State,2013
/player/darnell-bing?position=DB, Darnell Bing, S, USC,2006
/player/chris-hackett?position=DB, Chris Hackett, S, TCU,2015
/player/chris-harrell?position=DB, Chris Harrell, S, Penn State,2006
/player/chris-harris?position=DB, Chris Harris, S, Kansas,2011
/player/chris-hawkins?position=DB, Chris Hawkins, CB, Marshall,2006
/player/chris-hawkins-2010?position=DB, Chris Hawkins, CB, LSU,2010
/player/chris-hope?position=DB, Chris Hope, S, Florida State,2002
/player/chris-horton?position=DB, Chris Horton, S, UCLA,2008
/player/chris-houston?position=DB, Chris Houston, CB, Arkansas,2007
/player/chris-mcalister?position=DB, Chris McAlister, CB, Arizona,1999
/player/chris-mckenzie?position=DB, Chris McKenzie, CB, Arizona State,2005
/player/chris-rucker?position=DB, Chris Rucker, CB, Michigan State,2011
/player/chris-thompson?position=DB, Chris Thompson, CB, Nicholls State,2004
/player/chris-watson?position=DB, Chris Watson, CB, Eastern Illinois,1999
/player/chris-young?position=DB, Chris Young, S, Georgia Tech,2002
/player/christian-thompson?position=DB, Christian Thompson, S, South Carolina State,2012
/player/christopher-owens?position=DB, Christopher Owens, CB, San Jose State,2009
/player/chuck-clark?position=DB, Chuck Clark, DB, Virginia Tech,2017
/player/chykie-brown?position=DB, Chykie Brown, CB, Texas,2011
/player/clayton-geathers?position=DB, Clayton Geathers, S, UCF,2015
/player/clevan-thomas?position=DB, Clevan Thomas, CB, Florida State,2001
/player/ethan-howell?position=DB, Ethan Howell, CB, Oklahoma State,2000
/player/eugene-wilson?position=DB, Eugene Wilson, CB, Illinois,2003
/player/etric-pruitt?position=DB, Etric Pruitt, S, Southern Miss,2004
/player/fabian-moreau?position=DB, Fabian Moreau, CB, UCLA,2017
/player/ezra-robinson?position=DB, Ezra Robinson, CB, Tennessee State,2017
/player/fabian-washington?position=DB, Fabian Washington, CB, Nebraska,2005
/player/fernando-bryant?position=DB, Fernando Bryant, CB, Alabama,1999
/player/fred-bennett?position=DB, Fred Bennett, CB, South Carolina,2007
/player/fred-vinson?position=DB, Fred Vinson, CB, Vanderbilt,1999
/player/gana-joseph?position=DB, Gana Joseph, S, Oklahoma,1999
/player/gareon-conley?position=DB, Gareon Conley, CB, Ohio State,2017
/player/garry-peters?position=DB, Garry Peters, CB, Clemson,2015
/player/gary-baxter?position=DB, Gary Baxter, CB, Baylor,2001
/player/george-iloka?position=DB, George Iloka, S, Boise State,2012
/player/gerald-alexander?position=DB, Gerald Alexander, S, Boise State,2007
/player/gerald-neasman?position=DB, Gerald Neasman, CB, Kansas State,1999
/player/gerald-sensabaugh?position=DB, Gerald Sensabaugh, S, North Carolina,2005
/player/gerod-holliman?position=DB, Gerod Holliman, S, Louisville,2015
/player/gerome-sapp?position=DB, Gerome Sapp, S, Notre Dame,2003
/player/gerrick-mcphearson?position=DB, Gerrick McPhearson, CB, Maryland,2006
/player/jaquiski-tartt?position=DB, Jaquiski Tartt, S, Samford,2015
/player/jarrad-page?position=DB, Jarrad Page, S, UCLA,2006
/player/jarrod-cooper?position=DB, Jarrod Cooper, S, Kansas State,2001
/player/jarvis-herring?position=DB, Jarvis Herring, S, Florida,2006
/player/jason-allen?position=DB, Jason Allen, S, Tennessee,2006
/player/jason-bray?position=DB, Jason Bray, CB, Auburn,1999
/player/jason-craft?position=DB, Jason Craft, CB, Colorado State,1999
/player/jason-goss?position=DB, Jason Goss, CB, TCU,2003
/player/jason-harmon?position=DB, Jason Harmon, S, Michigan State,2005
/player/jason-hebert?position=DB, Jason Hebert, S, Rice,2002
/player/jason-perry?position=DB, Jason Perry, S, NC State,1999
/player/jason-shivers?position=DB, Jason Shivers, S, Arizona State,2004
/player/jason-verrett?position=DB, Jason Verrett, CB, TCU,2014
/player/jason-webster?position=DB, Jason Webster, CB, Texas A&M,2000
/player/javier-arenas?position=DB, Javier Arenas, CB, Alabama,2010
/player/jawanza-starling?position=DB, Jawanza Starling, S, USC,2013
/player/jayjay-johnson?position=DB, Jay Jay Johnson, CB, Purdue,2013
/player/jaylen-watkins?position=DB, Jaylen Watkins, CB, Florida,2014
/player/jayron-hosley?position=DB, Jayron Hosley, CB, Virginia Tech,2012
/player/jayron-kearse?position=DB, Jayron Kearse, S, Clemson,2016
/player/gibril-wilson?position=DB, Gibril Wilson, S, Tennessee,2004
/player/glenn-earl?position=DB, Glenn Earl, S, Notre Dame,2004
/player/glover-quin?position=DB, Glover Quin, S, New Mexico,2009
/player/greg-blue?position=DB, Greg Blue, S, Georgia,2006
/player/greg-reid?position=DB, Greg Reid, CB, Florida State,2013
/player/guss-scott?position=DB, Guss Scott, S, Florida,2004
/player/haha-clintondix?position=DB, Ha Ha Clinton-Dix, S, Alabama,2014
/player/hamza-abdullah?position=DB, Hamza Abdullah, S, Washington State,2005
/player/hanik-milligan?position=DB, Hanik Milligan, S, Houston,2003
/player/hank-poteat?position=DB, Hank Poteat, CB, Pittsburgh,2000
/player/harlan-miller?position=DB, Harlan Miller, CB, Southeastern Louisiana,2016
/player/harold-blackmon?position=DB, Harold Blackmon, CB, Northwestern,2001
/player/harrison-smith?position=DB, Harrison Smith, S, Notre Dame,2012
/player/harry-coleman?position=DB, Harry Coleman, S, LSU,2010
/player/howard-wilson?position=DB, Howard Wilson, CB, Houston,2017
/player/husain-abdullah?position=DB, Husain Abdullah, S, Washington State,2008
/player/ibraheim-campbell?position=DB, Ibraheim Campbell, S, Northwestern,2015
/player/idrees-bashir?position=DB, Idrees Bashir, S, Memphis,2001
/player/ifeanyi-ohalete?position=DB, Ifeanyi Ohalete, S, USC,2001
/player/ifo-ekpreolomu?position=DB, Ifo Ekpre-Olomu, CB, Oregon,2015
/player/ike-charlton?position=DB, Ike Charlton, CB, Virginia Tech,2000
/player/isaiah-lewis?position=DB, Isaiah Lewis, S, Michigan State,2014
/player/jd-nelson?position=DB, J.D. Nelson, S, Oregon,2007
/player/jj-wilcox?position=DB, J.J. Wilcox, S, Georgia Southern,2013
/player/jacorey-shepherd?position=DB, JaCorey Shepherd, CB, Kansas,2015
/player/jabari-greer?position=DB, Jabari Greer, CB, Tennessee,2004
/player/jabari-price?position=DB, Jabari Price, CB, North Carolina,2014
/player/jack-brewer?position=DB, Jack Brewer, S, Minnesota,2002
/player/jack-tocho?position=DB, Jack Tocho, CB, NC State,2017
/player/jack-williams?position=DB, Jack Williams, S, Azusa Pacific,2000
/player/jack-williams-2008?position=DB, Jack Williams, CB, Kent State,2008
/player/jacoby-glenn?position=DB, Jacoby Glenn, CB, UCF,2015
/player/jacoby-rhinehart?position=DB, Jacoby Rhinehart, CB, SMU,1999
/player/jacoby-shepherd?position=DB, Jacoby Shepherd, CB, Oklahoma State,2000
/player/jadar-johnson?position=DB, Jadar Johnson, S, Clemson,2017
/player/jahi-worddaniels?position=DB, Jahi Word-Daniels, CB, Georgia Tech,2009
/player/jahmile-addae?position=DB, Jahmile Addae, S, West Virginia,2006
/player/jaiquawn-jarrett?position=DB, Jaiquawn Jarrett, S, Temple,2011
/player/jalen-collins?position=DB, Jalen Collins, CB, LSU,2015
/player/jalen-mills?position=DB, Jalen Mills, S, LSU,2016
/player/jalen-myrick?position=DB, Jalen Myrick, CB, Minnesota,2017
/player/jalen-ramsey?position=DB, Jalen Ramsey, CB, Florida State,2016
/player/jamaal-brimmer?position=DB, Jamaal Brimmer, S, UNLV,2005
/player/jalil-brown?position=DB, Jalil Brown, CB, Colorado,2011
/player/jamal-adams?position=DB, Jamal Adams, S, LSU,2017
/player/jamal-carter?position=DB, Jamal Carter, S, Miami,2017
/player/jamar-adams?position=DB, Jamar Adams, S, Michigan,2008
/player/jamar-taylor?position=DB, Jamar Taylor, CB, Boise State,2013
/player/jamar-wall?position=DB, Jamar Wall, CB, Texas Tech,2010
/player/jamarca-sanford?position=DB, Jamarca Sanford, S, Ole Miss,2009
/player/jamell-fleming?position=DB, Jamell Fleming, CB, Oklahoma,2012
/player/james-boyd?position=DB, James Boyd, S, Penn State,2001
/player/james-bradberry?position=DB, James Bradberry, CB, Samford,2016
/player/james-butler?position=DB, James Butler, S, Georgia Tech,2005
/player/james-sample?position=DB, James Sample, S, Louisville,2015
/player/james-whitley?position=DB, James Whitley, CB, Michigan,2001
/player/jamie-henderson?position=DB, Jamie Henderson, CB, Georgia,2001
/player/jamie-silva?position=DB, Jamie Silva, S, Boston College,2008
/player/janoris-jenkins?position=DB, Janoris Jenkins, CB, North Alabama,2012
/player/janzen-jackson?position=DB, Janzen Jackson, S, McNeese State,2012
/player/jeff-harris?position=DB, Jeff Harris, CB, Georgia,2000
/player/jemea-thomas?position=DB, Jemea Thomas, CB, Georgia Tech,2014
/player/jerametrius-butler?position=DB, Jerametrius Butler, CB, Kansas State,2001
/player/jeremy-cash?position=DB, Jeremy Cash, S, Duke,2016
/player/jeremy-clark-2017?position=DB, Jeremy Clark, CB, Michigan,2017
/player/jeremy-jones?position=DB, Jeremy Jones, CB, Wayne State,2012
/player/jeremy-lesueur?position=DB, Jeremy LeSueur, CB, Michigan,2004
/player/jermaine-chatman?position=DB, Jermaine Chatman, CB, Arizona,2002
/player/jermaine-jones?position=DB, Jermaine Jones, CB, Northwestern State,1999
/player/jermaine-phillips?position=DB, Jermaine Phillips, S, Georgia,2002
/player/jermaine-whitehead?position=DB, Jermaine Whitehead, S, Auburn,2015
/player/jermale-hines?position=DB, Jermale Hines, S, Ohio State,2011
/player/jerome-carter?position=DB, Jerome Carter, S, Florida State,2005
/player/jerome-murphy?position=DB, Jerome Murphy, CB, South Florida,2010
/player/jeron-johnson?position=DB, Jeron Johnson, S, Boise State,2011
/player/jerrard-tarrant?position=DB, Jerrard Tarrant, S, Georgia Tech,2011
/player/jerraud-powers?position=DB, Jerraud Powers, CB, Auburn,2009
/player/jerron-mcmillian?position=DB, Jerron McMillian, S, Maine,2012
/player/jerron-wishom?position=DB, Jerron Wishom, CB, Louisiana Tech,2005
/player/jessie-daniels?position=DB, Jessie Daniels, S, LSU,2007
/player/justin-tryon?position=DB, Justin Tryon, CB, Arizona State,2008
/player/justin-woodall?position=DB, Justin Woodall, S, Alabama,2010
/player/juston-burris?position=DB, Juston Burris, CB, NC State,2016
/player/kj-dillon?position=DB, K.J. Dillon, S, West Virginia,2016
/player/kai-nacua?position=DB, Kai Nacua, S, BYU,2017
/player/kam-chancellor?position=DB, Kam Chancellor, S, Virginia Tech,2010
/player/kareem-jackson?position=DB, Kareem Jackson, CB, Alabama,2010
/player/kareem-larrimore?position=DB, Kareem Larrimore, CB, West Texas A&M,2000
/player/karl-joseph?position=DB, Karl Joseph, S, West Virginia,2016
/player/karl-paymah?position=DB, Karl Paymah, CB, Washington State,2005
/player/kavon-frazier?position=DB, Kavon Frazier, S, Central Michigan,2016
/player/kayvon-webster?position=DB, Kayvon Webster, CB, South Florida,2013
/player/keanu-neal?position=DB, Keanu Neal, S, Florida,2016
/player/keelan-johnson?position=DB, Keelan Johnson, S, Arizona State,2013
/player/keenan-lewis?position=DB, Keenan Lewis, CB, Oregon State,2009
/player/keivarae-russell?position=DB, KeiVarae Russell, CB, Notre Dame,2016
/player/keith-lewis?position=DB, Keith Lewis, S, Oregon,2004
/player/keith-mcgill?position=DB, Keith McGill, CB, Utah,2014
/player/keith-reaser?position=DB, Keith Reaser, CB, Florida Atlantic,2014
/player/keith-smith?position=DB, Keith Smith, CB, McNeese State,2004
/player/jim-leonhard?position=DB, Jim Leonhard, S, Wisconsin,2005
/player/jimmie-ward?position=DB, Jimmie Ward, S, Northern Illinois,2014
/player/jimmy-pruitt?position=DB, Jimmy Pruitt, CB, San Jose State,2016
/player/jimmy-smith?position=DB, Jimmy Smith, CB, Colorado,2011
/player/jimmy-williams?position=DB, Jimmy Williams, CB, Vanderbilt,2001
/player/joe-burnett?position=DB, Joe Burnett, CB, UCF,2009
/player/joe-haden?position=DB, Joe Haden, CB, Florida,2010
/player/joe-lefeged?position=DB, Joe Lefeged, S, Rutgers,2011
/player/joey-thomas?position=DB, Joey Thomas, CB, Montana State,2004
/player/john-boyett?position=DB, John Boyett, S, Oregon,2013
/player/john-howell?position=DB, John Howell, S, Colorado State,2001
/player/john-johnson?position=DB, John Johnson, S, Boston College,2017
/player/john-walker?position=DB, John Walker, CB, USC,2006
/player/johnathan-cyprien?position=DB, Johnathan Cyprien, S, FIU,2013
/player/john-wendling?position=DB, John Wendling, S, Wyoming,2007
/player/johnathan-joseph?position=DB, Johnathan Joseph, CB, South Carolina,2006
/player/johndale-carty?position=DB, Johndale Carty, S, Utah State,1999
/player/johnny-adams?position=DB, Johnny Adams, CB, Michigan State,2013
/player/johnny-patrick?position=DB, Johnny Patrick, CB, Louisville,2011
/player/johnny-thomas?position=DB, Johnny Thomas, S, Oklahoma State,2012
/player/keiwan-ratliff?position=DB, Keiwan Ratliff, CB, Florida,2004
/player/kelcie-mccray?position=DB, Kelcie McCray, S, Arkansas State,2012
/player/kelly-jennings?position=DB, Kelly Jennings, CB, Miami,2006
/player/kelvin-hayden?position=DB, Kelvin Hayden, CB, Illinois,2005
/player/ken-crawley?position=DB, Ken Crawley, CB, Colorado,2016
/player/ken-hamlin?position=DB, Ken Hamlin, S, Arkansas,2003
/player/kendall-fuller?position=DB, Kendall Fuller, CB, Virginia Tech,2016
/player/kendall-james?position=DB, Kendall James, CB, Maine,2014
/player/kendric-burney?position=DB, Kendric Burney, CB, North Carolina,2011
/player/kendrick-lewis?position=DB, Kendrick Lewis, S, Ole Miss,2010
/player/kenneth-grant?position=DB, Kenneth Grant, CB, Kentucky,2001
/player/kenny-bryant?position=DB, Kenny Bryant, CB, Jackson State,2001
/player/kenny-ladler?position=DB, Kenny Ladler, S, Vanderbilt,2014
/player/kenny-phillips?position=DB, Kenny Phillips, S, Miami,2008
/player/kenny-scott?position=DB, Kenny Scott, CB, Georgia Tech,2007
/player/kenny-vaccaro?position=DB, Kenny Vaccaro, S, Texas,2013
/player/kenoy-kennedy?position=DB, Kenoy Kennedy, S, Arkansas,2000
/player/kentrell-curry?position=DB, Kentrell Curry, S, Georgia,2004
/player/keon-moore?position=DB, Keon Moore, CB, Southern Miss,2001
/player/kerry-rhodes?position=DB, Kerry Rhodes, S, Louisville,2005
/player/lenny-walls?position=DB, Lenny Walls, CB, Boston College,2002
/player/leodis-mckelvin?position=DB, Leodis McKelvin, CB, Troy,2008
/player/leon-hall?position=DB, Leon Hall, CB, Michigan,2007
/player/leon-mcfadden?position=DB, Leon McFadden, CB, San Diego State,2013
/player/leonard-johnson?position=DB, Leonard Johnson, CB, Iowa State,2012
/player/leonard-myers?position=DB, Leonard Myers, CB, Miami,2001
/player/leonard-peters?position=DB, Leonard Peters, S, Hawai'i,2007
/player/lewis-sanders?position=DB, Lewis Sanders, CB, Maryland,2000
/player/ligarius-jennings?position=DB, Ligarius Jennings, CB, Tennessee State,2001
/player/lloyd-harrison?position=DB, Lloyd Harrison, CB, NC State,2000
/player/logan-ryan?position=DB, Logan Ryan, CB, Rutgers,2013
/player/lorenzo-doss?position=DB, Lorenzo Doss, CB, Tulane,2015
/player/lorenzo-jerome?position=DB, Lorenzo Jerome, S, St. Francis (PA),2017
/player/loucheiz-purifoy?position=DB, Loucheiz Purifoy, CB, Florida,2014
/player/louis-delmas?position=DB, Louis Delmas, S, Western Michigan,2009
/player/lucien-antoine?position=DB, Lucien Antoine, S, Oklahoma State,2010
/player/lydell-sargeant?position=DB, Lydell Sargeant, CB, Penn State,2009
/player/mackensie-alexander?position=DB, Mackensie Alexander, CB, Clemson,2016
/player/madieu-williams?position=DB, Madieu Williams, S, Maryland,2004
/player/major-wright?position=DB, Major Wright, S, Florida,2010
/player/mario-butler?position=DB, Mario Butler, CB, Georgia Tech,2011
/player/mario-edwards?position=DB, Mario Edwards, CB, Florida State,2000
/player/mark-barron?position=DB, Mark Barron, S, Alabama,2012
/player/mark-legree?position=DB, Mark LeGree, S, Appalachian State,2011
/player/markelle-martin?position=DB, Markelle Martin, S, Oklahoma State,2012
/player/markus-curry?position=DB, Markus Curry, CB, Michigan,2005
/player/marlin-jackson?position=DB, Marlin Jackson, CB, Michigan,2005
/player/marlon-humphrey?position=DB, Marlon Humphrey, CB, Alabama,2017
/player/marlon-mccree?position=DB, Marlon McCree, S, Kentucky,2001
/player/marquand-manuel?position=DB, Marquand Manuel, S, Florida,2002
/player/marques-anderson?position=DB, Marques Anderson, S, UCLA,2002
/player/marqueston-huff?position=DB, Marqueston Huff, S, Wyoming,2014
/player/marquez-white?position=DB, Marquez White, CB, Florida State,2017
/player/marquis-smith?position=DB, Marquis Smith, S, California,1999
/player/marquis-weeks?position=DB, Marquis Weeks, S, Virginia,2005
/player/marshon-lattimore?position=DB, Marshon Lattimore, CB, Ohio State,2017
/player/marviel-underwood?position=DB, Marviel Underwood, S, San Diego State,2005
/player/marvin-love?position=DB, Marvin Love, CB, Kentucky,1999
/player/marvin-white?position=DB, Marvin White, S, TCU,2007
/player/matt-bowen?position=DB, Matt Bowen, S, Iowa,2000
/player/johnthan-banks?position=DB, Johnthan Banks, CB, Mississippi State,2013
/player/jon-amaya?position=DB, Jon Amaya, S, Nevada,2010
/player/jon-mcgraw?position=DB, Jon McGraw, S, Kansas State,2002
/player/jonathan-dowling?position=DB, Jonathan Dowling, S, Western Kentucky,2014
/player/jonathan-hefney?position=DB, Jonathan Hefney, S, Tennessee,2008
/player/jonathan-jones?position=DB, Jonathan Jones, CB, Auburn,2016
/player/jonathan-wade?position=DB, Jonathan Wade, CB, Tennessee,2007
/player/jonathan-wilhite?position=DB, Jonathan Wilhite, CB, Auburn,2008
/player/jonathan-zenon?position=DB, Jonathan Zenon, CB, LSU,2008
/player/jordan-lomax?position=DB, Jordan Lomax, S, Iowa,2016
/player/jordan-lucas?position=DB, Jordan Lucas, S, Penn State,2016
/player/jordan-poyer?position=DB, Jordan Poyer, CB, Oregon State,2013
/player/jordan-richards?position=DB, Jordan Richards, S, Stanford,2015
/player/joseph-jefferson?position=DB, Joseph Jefferson, CB, Western Kentucky,2002
/player/josh-barrett?position=DB, Josh Barrett, S, Arizona State,2008
/player/josh-bullocks?position=DB, Josh Bullocks, S, Nebraska,2005
/player/josh-evans?position=DB, Josh Evans, S, Florida,2013
/player/josh-gattis?position=DB, Josh Gattis, S, Wake Forest,2007
/player/josh-harvey-clemons?position=DB, Josh Harvey-Clemons, S, Louisville,2017
/player/josh-jones?position=DB, Josh Jones, S, NC State,2017
/player/josh-lay?position=DB, Josh Lay, CB, Pittsburgh,2006
/player/josh-norman-2012?position=DB, Josh Norman, CB, Coastal Carolina,2012
/player/josh-robinson?position=DB, Josh Robinson, CB, UCF,2012
/player/josh-shaw-2015?position=DB, Josh Shaw, CB, USC,2015
/player/josh-thomas?position=DB, Josh Thomas, CB, Buffalo,2011
/player/josh-wilson?position=DB, Josh Wilson, CB, Maryland,2007
/player/joshua-moore?position=DB, Joshua Moore, CB, Kansas State,2010
/player/jourdan-lewis?position=DB, Jourdan Lewis, CB, Michigan,2017
/player/julian-wilson?position=DB, Julian Wilson, CB, Oklahoma,2015
/player/justin-beriault?position=DB, Justin Beriault, S, Ball State,2005
/player/justin-bethel?position=DB, Justin Bethel, CB, Presbyterian,2012
/player/justin-coleman-2015?position=DB, Justin Coleman, CB, Tennessee,2015
/player/justin-cox?position=DB, Justin Cox, S, Mississippi State,2015
/player/justin-evans?position=DB, Justin Evans, S, Texas A&M,2017
/player/justin-gilbert?position=DB, Justin Gilbert, CB, Oklahoma State,2014
/player/justin-king?position=DB, Justin King, CB, Penn State,2008
/player/justin-mckinney?position=DB, Justin McKinney, CB, Kansas State,2008
/player/justin-miller?position=DB, Justin Miller, CB, Clemson,2005
/player/justin-rogers?position=DB, Justin Rogers, CB, Richmond,2011
/player/justin-simmons?position=DB, Justin Simmons, S, Boston College,2016
/player/matt-elam?position=DB, Matt Elam, S, Florida,2013
/player/matt-graham?position=DB, Matt Graham, S, Indiana State,1999
/player/matt-grootegoed?position=DB, Matt Grootegoed, S, USC,2005
/player/matt-ware?position=DB, Matt Ware, S, UCLA,2004
/player/matterral-richardson?position=DB, Matterral Richardson, CB, Arkansas,2008
/player/maurice-canady?position=DB, Maurice Canady, CB, Virginia,2016
/player/mel-mitchell?position=DB, Mel Mitchell, S, Western Kentucky,2002
/player/micah-hyde?position=DB, Micah Hyde, CB, Iowa,2013
/player/micah-pellerin?position=DB, Micah Pellerin, CB, Hampton,2012
/player/michael-coe?position=DB, Michael Coe, CB, Alabama State,2007
/player/michael-grant?position=DB, Michael Grant, CB, Arkansas,2008
/player/michael-griffin?position=DB, Michael Griffin, S, Texas,2007
/player/michael-hamlin?position=DB, Michael Hamlin, S, Clemson,2009
/player/michael-huff?position=DB, Michael Huff, S, Texas,2006
/player/michael-jameson?position=DB, Michael Jameson, S, Texas A&M,2001
/player/michael-johnson?position=DB, Michael Johnson, S, Arizona,2007
/player/michael-lewis?position=DB, Michael Lewis, S, Colorado,2002
/player/michael-stone?position=DB, Michael Stone, CB, Memphis,2001
/player/michael-tyson?position=DB, Michael Tyson, S, Cincinnati,2017
/player/michael-waddell?position=DB, Michael Waddell, CB, North Carolina,2004
/player/mike-brown?position=DB, Mike Brown, S, Nebraska,2000
/player/mike-edwards?position=DB, Mike Edwards, CB, Hawai'i,2013
/player/mike-green-2000?position=DB, Mike Green, S, Northwestern State,2000
/player/mike-harris?position=DB, Mike Harris, CB, Florida State,2012
/player/mike-jenkins?position=DB, Mike Jenkins, CB, South Florida,2008
/player/mike-lehan?position=DB, Mike Lehan, CB, Minnesota,2003
/player/mike-mckenzie?position=DB, Mike McKenzie, S, Memphis,1999
/player/miles-killebrew?position=DB, Miles Killebrew, S, Southern Utah,2016
/player/mitchell-freedman?position=DB, Mitchell Freedman, S, Arizona,1999
/player/mo-alexander?position=DB, Mo Alexander, S, Utah State,2014
/player/montae-nicholson?position=DB, Montae Nicholson, S, Michigan State,2017
/player/morgan-burnett?position=DB, Morgan Burnett, S, Georgia Tech,2010
/player/morgan-trent?position=DB, Morgan Trent, CB, Michigan,2009
/player/morris-claiborne?position=DB, Morris Claiborne, CB, LSU,2012
/player/myron-lewis?position=DB, Myron Lewis, S, Vanderbilt,2010
/player/myron-rolle?position=DB, Myron Rolle, S, Florida State,2010
/player/myron-terry?position=DB, Myron Terry, S, Colorado State,1999
/player/nat-berhe?position=DB, Nat Berhe, S, San Diego State,2014
/player/nate-allen?position=DB, Nate Allen, S, South Florida,2010
/player/nate-gerry?position=DB, Nate Gerry, S, Nebraska,2017
/player/kurtis-drummond?position=DB, Kurtis Drummond, S, Michigan State,2015
/player/kyle-fuller?position=DB, Kyle Fuller, CB, Virginia Tech,2014
/player/kyle-mccarthy?position=DB, Kyle McCarthy, S, Notre Dame,2010
/player/kyle-wilson?position=DB, Kyle Wilson, CB, Boise State,2010
/player/kyshoen-jarrett?position=DB, Kyshoen Jarrett, S, Virginia Tech,2015
/player/laron-landry?position=DB, LaRon Landry, S, LSU,2007
/player/lavar-glover?position=DB, LaVar Glover, CB, Cincinnati,2002
/player/ladarius-gunter?position=DB, Ladarius Gunter, CB, Miami,2015
/player/lamar-grant?position=DB, Lamar Grant, CB, Duke,2000
/player/lamarcus-brutus?position=DB, Lamarcus Brutus, S, Florida State,2016
/player/lamarcus-joyner?position=DB, Lamarcus Joyner, CB, Florida State,2014
/player/lamont-reid?position=DB, Lamont Reid, CB, NC State,2005
/player/lamont-thompson?position=DB, Lamont Thompson, S, Washington State,2002
/player/landon-collins?position=DB, Landon Collins, S, Alabama,2015
/player/lardarius-webb?position=DB, Lardarius Webb, CB, Nicholls State,2009
/player/larry-asante?position=DB, Larry Asante, S, Nebraska,2010
/player/lavelle-westbrooks?position=DB, Lavelle Westbrooks, CB, Georgia Southern,2014
/player/lawrence-richardson?position=DB, Lawrence Richardson, CB, Arkansas,2004
/player/leshaun-sims?position=DB, LeShaun Sims, CB, Southern Utah,2016
/player/lendy-holmes?position=DB, Lendy Holmes, S, Oklahoma,2009
/player/pat-watkins?position=DB, Pat Watkins, S, Florida State,2006
/player/patrick-body?position=DB, Patrick Body, S, Toledo,2005
/player/patrick-chung?position=DB, Patrick Chung, S, Oregon,2009
/player/patrick-dyson?position=DB, Patrick Dyson, CB, Utah,2001
/player/patrick-lee?position=DB, Patrick Lee, CB, Auburn,2008
/player/patrick-peterson?position=DB, Patrick Peterson, CB, LSU,2011
/player/patrick-robinson?position=DB, Patrick Robinson, CB, Florida State,2010
/player/paul-miranda?position=DB, Paul Miranda, CB, UCF,1999
/player/perrish-cox?position=DB, Perrish Cox, CB, Oklahoma State,2010
/player/phillip-gaines?position=DB, Phillip Gaines, CB, Rice,2014
/player/phillip-thomas?position=DB, Phillip Thomas, S, Syracuse,2012
/player/phillip-thomas-2013?position=DB, Phillip Thomas, S, Fresno State,2013
/player/pierre-desir?position=DB, Pierre Desir, CB, Lindenwood,2014
/player/pierson-prioleau?position=DB, Pierson Prioleau, S, Virginia Tech,1999
/player/prince-amukamara?position=DB, Prince Amukamara, CB, Nebraska,2011
/player/quandre-diggs?position=DB, Quandre Diggs, CB, Texas,2015
/player/quentin-harris?position=DB, Quentin Harris, S, Syracuse,2002
/player/quentin-jammer?position=DB, Quentin Jammer, CB, Texas,2002
/player/quincy-wilson-2017?position=DB, Quincy Wilson, CB, Florida,2017
/player/quinten-rollins?position=DB, Quinten Rollins, CB, Miami (Ohio),2015
/player/kevin-barnes?position=DB, Kevin Barnes, CB, Maryland,2009
/player/kevin-brooks?position=DB, Kevin Brooks, CB, South Carolina,1999
